All the children in the neighbourhood know him and treat him as if he were their president.,"Alle Kinder im Viertel kennen ihn und behandeln ihn, als wäre er ihr Präsident."
"I am fine, which I hope you guys are too.","Mir geht's gut, was ich von Euch auch hoffe."
Everything that happens will be in the papers. It just needs to be a little bit extraordinary.,"Alles was geschieht, kommt in die Zeitung. Es muss nur ein bisschen außergewöhnlich sein."
"You're going to Berlin, I hear.","Du fährst nach Berlin, wie ich höre."
Can't you tell me who invented the good suits?,"Kannst du mir nicht sagen, wer die guten Anzüge erfunden hat?"
The flowers for your aunt are wrapped.,Die Blumen für die Tante sind eingewickelt.
There was macaroni with ham and grated parmesan cheese.,Es gab Makkaroni mit Schinken und geriebenem Parmesankäse.
